{
  "author": "cogym-lab",
  "candidate": {
    "config": {
      "style": "direct"
    },
    "kind": "llm_subject",
    "version": "1"
  },
  "claim_id": "claim_5349b236f7150665c5c8c0e8",
  "created_at": "2026-08-24T05:23:03Z",
  "metrics": {
    "direction_accuracy": 0.5,
    "mean_latency_s": 34.2,
    "utility_bps": -297.8
  },
  "mode": "PILOT",
  "model": {
    "id": "ox-alpha-free",
    "seeded": true,
    "temperature": 0.3
  },
  "n_decisions": 4,
  "receipts": [],
  "scenario_hash": "synthetic:level=2:seed=42:idx=60-90:h=5",
  "schema": "cogym.capability_claim.v1",
  "signature": null,
  "suite_seeds": [],
  "title": "Reasoning style 'direct' on trend-market replay",
  "verification": {
    "binary_k": 1,
    "binary_outcome": "ABSTAIN",
    "deterministic_pass": true,
    "final": "PROVISIONAL"
  },
  "world": "trading.synthetic",
  "worldpack": null
}