{
  "author": "cogym-lab",
  "candidate": {
    "config": {
      "topology": "debate3"
    },
    "kind": "multi_agent_topology",
    "version": "1"
  },
  "claim_id": "claim_04b7752a558d052b4c598a52",
  "created_at": "2026-08-24T05:23:03Z",
  "metrics": {
    "utility_bps": 92.8
  },
  "mode": "PILOT",
  "model": {
    "id": "ox-alpha-free",
    "seeded": true,
    "temperature": 0.7
  },
  "n_decisions": 8,
  "receipts": [],
  "scenario_hash": "alpaca_bank:a621a0e19fa81566",
  "schema": "cogym.capability_claim.v1",
  "signature": null,
  "suite_seeds": [],
  "title": "Structured debate beats unstructured chat",
  "verification": {
    "binary_k": 1,
    "binary_outcome": "ABSTAIN",
    "deterministic_pass": true,
    "final": "PROVISIONAL"
  },
  "world": "alpaca.replay",
  "worldpack": null
}